{"$schema":"https://json-schema.org/draft/2020-12/schema","type":"object","additionalProperties":false,"required":["packet_id","seed_id","source_receipts","mapped_roles","proposed_question","fragility","alternative_explanation","independent_check","outcomes","material_mismatch","disposition","plain_language_verdict","next_permitted_action"],"properties":{"packet_id":{"const":"system-one-seed-candidate-packet-1"},"seed_id":{"const":"seed-stream-biofilm-compartment-contrast"},"source_receipts":{"type":"array","minItems":3,"items":{"type":"object","additionalProperties":false,"required":["url","location","finding"],"properties":{"url":{"type":"string","format":"uri"},"location":{"type":"string","minLength":10},"finding":{"type":"string","minLength":40}}}},"mapped_roles":{"type":"object","additionalProperties":false,"required":["system","unit","measurement","published_baseline","published_inference","claim_boundary"],"properties":{"system":{"type":"string","minLength":20},"unit":{"type":"string","minLength":15},"measurement":{"type":"string","minLength":20},"published_baseline":{"type":"string","minLength":30},"published_inference":{"type":"string","minLength":30},"claim_boundary":{"type":"string","minLength":30}}},"proposed_question":{"type":"string","minLength":60},"fragility":{"type":"string","minLength":40},"alternative_explanation":{"type":"string","minLength":40},"independent_check":{"type":"string","minLength":60},"outcomes":{"type":"object","additionalProperties":false,"required":["positive","null","contrary"],"properties":{"positive":{"type":"string","minLength":30},"null":{"type":"string","minLength":30},"contrary":{"type":"string","minLength":30}}},"material_mismatch":{"type":"string","minLength":40},"disposition":{"const":"interview-ready-domain-specific-candidate-packet"},"plain_language_verdict":{"type":"string","minLength":60},"next_permitted_action":{"type":"string","minLength":30}}}
